Sheet: Hoja1
B1: Macro 1
E3: 20
C4: 10 | D4: =IF(RC[-1]<10,"És Menor",IF(RC[-1]>10,"És>Major","Són iguals")) -> Són iguals
B7: Macro 2
C8: 12 | D8: =MOD(RC[-1],2) -> 0 | E8: =IF(RC[-1]=0,"És parell","És senar") -> És parell
C12: Numeros | D12: Bin a | E12: Oct a | F12: Dec a | G12: Hex a
B13: Bin | C13: 1010 | D13: =RC[-1] -> 1010 | E13: =OCT2BIN(R[1]C[-2],4) -> 1100 | F13: =DEC2BIN(R[1]C[-3],4) -> 1110 | G13: =HEX2BIN(R[1]C[-4]) -> 10100
A14: Macro 3 | B14: Oct | C14: 14 | D14: =BIN2OCT(R[-1]C[-1]) -> 12 | E14: =(RC[-2]) -> 14 | F14: =DEC2OCT(RC[-3]) -> 16 | G14: =HEX2OCT(RC[-4]) -> 24
B15: Dec | C15: 1110 | D15: =BIN2DEC(R[-2]C[-1]) -> 10 | E15: =OCT2DEC(RC[-2]) -> 584 | F15: =RC[-3] -> 1110 | G15: =HEX2DEC(RC[-4]) -> 4368
B16: Hex | C16: 1010 | D16: =BIN2HEX(R[-3]C[-1]) -> A | E16: =OCT2HEX(RC[-2]) -> 208 | F16: =DEC2HEX(RC[-3]) -> 3F2 | G16: =RC[-4] -> 1010